{
  "schemaVersion": "nodekit.evolution-evidence/v1",
  "id": "evd:convex-caseflow-receipt-retry-materiality",
  "kind": "human-review",
  "artifactRef": "file:evolution/artifacts/convex-caseflow-receipt-retry-materiality.md",
  "sha256": "e72f56780f9220bd140a5ac2679578d51ddfb1fbf128f6d030915fbbe198f357",
  "sourceCommit": "4407b70c616c89b022e0d3d36ba02f00519b1688",
  "generatedAt": "2026-07-22T02:33:14-07:00",
  "environment": {
    "repository": "HomenShum/node-platform",
    "reviewer": "project-owner",
    "proofScope": "materiality contract only; exact provider and consumer proof pending"
  },
  "verifiesInvariantIds": [
    "inv:caseflow-receipt-retry-containment"
  ],
  "result": "partial"
}
